{
  "schema_version": "0.1.0",
  "case_id": "context-006",
  "title": "Optional component charge review",
  "description": "review_package(request) validates all input before evaluating alternatives; invalid input raises ValueError (message unspecified). Do not mutate input. All components are optional; any subset including empty is allowed. Its charge is base_cost plus the cost of each selected component plus every adjustment whose two members are both selected. Signed costs represent charges or credits; repeated and reversed adjustments are separate additive entries, never deduplicated. Return component_count, base_cost, current, lowest_cost, avoidable_cost. current contains selected in component input order, component_cost, applied_adjustment_indices in adjustment input order (zero-based), adjustment_cost, total_cost. lowest_cost is the exact least attainable total charge over all subsets. avoidable_cost equals current.total_cost minus lowest_cost; it is nonnegative. Do not return or require a particular attaining subset; ties do not affect the numeric result. Empty catalogues return base_cost. CLI reads one JSON request and prints one report; invalid input has nonzero exit and no successful report.",
  "source": "Codex-assisted synthetic functional-context adaptation of existing pilot-006; source function preserved. No external-paper or deployed-system provenance.",
  "source_url": null,
  "license": "NOASSERTION",
  "domain": "synthetic_reference_context",
  "version": "0.3.0",
  "migration_family": null,
  "context_level": "small_program",
  "case_type": "positive",
  "difficulty": "unknown",
  "files": [
    "program.py",
    "packages.py"
  ],
  "candidate_regions": [
    {
      "file": "packages.py",
      "function": "minimum_energy",
      "start_line": 52,
      "end_line": 59
    }
  ],
  "structural_eligibility": null,
  "practical_suitability": null,
  "benchmark_supported": null,
  "expected_decision": null,
  "computational_intent": null,
  "admissible_migration_contracts": [],
  "reference_plan": null,
  "reference_hybrid_implementation": null,
  "classical_tests": [
    "test_program.py"
  ],
  "semantic_oracle": {
    "kind": "property",
    "description": "DRAFT Named subset catalogue oracle checks the additive charge model, duplicate adjustments, exact least cost and current report.",
    "config": {
      "test_artifact": "test_program.py",
      "approximation_permitted": false,
      "probabilistic_policy": null
    }
  },
  "resource_expectations": {
    "assumptions": [
      "Integer catalogue units are abstract charges, not measured runtime or an economic forecast. All stated component combinations are permitted.",
      "No hardware, workload-size distribution, circuit cost, latency target or practical benefit is supplied."
    ],
    "limits": {}
  },
  "negative_reason": null,
  "annotation_rationale": "DRAFT / AI-ASSISTED PROPOSAL — NOT GROUND TRUTH. Sampling category and region nomination are private design intentions. Scientific fields remain null; previous pilot labels are not copied. Functional correctness tests are not quantumization labels.",
  "annotators": [],
  "annotation_status": "DRAFT",
  "limitations": [
    "DRAFT synthetic functionality, not a deployed software case or independent annotation.",
    "Related views and parent source must remain grouped in any future split; parent is 006.",
    "Source names and visible computations may cue intent. No proven increase in WHERE difficulty.",
    "No quantum migration, practical advantage, oracle/encoding correctness, or scientific labels validated.",
    "Package and new code rights remain NOASSERTION."
  ]
}
